{
  "$schema": "https://json-schema.org/draft/2020-12/schema",
  "$id": "https://downtrace.io/schema/v0/capture-evidence.schema.json",
  "title": "CaptureEvidence",
  "description": "What an instrumentation sends back for a capture the cloud asked for (POST /v0/captures/{id}/evidence). It is the contents of the black box, frozen: the fine register's requests with their operations, in order, with starts and ends, and the coarse summary of the previous minutes, second by second. Hashes only — the text of a query never travels here (invariant 5). Its own path and not the aggregates batch, because a batch is what goes out every ten seconds and this is a rare event several orders of magnitude larger.",
  "x-evidence-path": "/v0/captures/{id}/evidence",
  "type": "object",
  "additionalProperties": false,
  "required": ["protocol", "instance", "startedAt", "endedAt", "coverage", "requests"],
  "properties": {
    "protocol": {
      "type": "string",
      "description": "Protocol version this payload conforms to. Same enum as a batch: every published minor of v0 stays acceptable.",
      "enum": [
        "0.1.0",
        "0.2.0",
        "0.3.0",
        "0.4.0",
        "0.5.0",
        "0.6.0",
        "0.7.0",
        "0.8.0",
        "0.9.0",
        "0.10.0",
        "0.11.0",
        "0.12.0",
        "0.13.0"
      ]
    },
    "instance": {
      "type": "object",
      "additionalProperties": false,
      "required": ["id"],
      "description": "Which process observed this. Several instances of one deployment get the same order on purpose (ADR 0071), so the cloud has to be able to tell two answers apart.",
      "properties": {
        "id": {
          "type": "string",
          "minLength": 1,
          "maxLength": 128
        },
        "hostname": {
          "type": "string",
          "maxLength": 253
        },
        "pid": {
          "type": "integer",
          "minimum": 0
        }
      }
    },
    "startedAt": {
      "type": "string",
      "format": "date-time",
      "description": "The **effective start of observation**, which is the instant CAP-01 insists on keeping apart from the acceptance. It travels with the evidence rather than in a call of its own: a capture that started and never finished should not cost two requests."
    },
    "endedAt": {
      "type": "string",
      "format": "date-time",
      "description": "When the instrumentation stopped watching."
    },
    "coverage": {
      "$ref": "#/$defs/Coverage"
    },
    "requests": {
      "type": "array",
      "maxItems": 4096,
      "items": {
        "$ref": "#/$defs/CapturedRequest"
      },
      "description": "The requests observed, oldest first. An empty array is a real answer and the commonest one: a route nobody called during the window. It means the capture is `empty`, and `product.md:192` is explicit that this must never read as an invitation to ask again unchanged."
    },
    "reference": {
      "$ref": "#/$defs/Reference"
    },
    "coarse": {
      "$ref": "#/$defs/CoarseSummary"
    }
  },
  "$defs": {
    "Coverage": {
      "type": "object",
      "title": "CaptureCoverage",
      "additionalProperties": false,
      "required": ["observedRequests", "attachedRequests", "detailLost", "truncated"],
      "description": "`product.md:192` asks a capture to declare **both** coverages: what it attached from detail still retained, and what it observed from its effective start. Two numbers, never one — a total would hide that half of it is older than the capture.",
      "properties": {
        "observedRequests": {
          "type": "integer",
          "minimum": 0,
          "description": "Requests seen from the effective start onwards."
        },
        "attachedRequests": {
          "type": "integer",
          "minimum": 0,
          "description": "Requests that were already in the register when the capture started, and are attached. Zero is normal: the register may have wrapped, and nothing brings back what was not kept."
        },
        "detailLost": {
          "type": "integer",
          "minimum": 0,
          "description": "Requests whose operations were overwritten before they could be read. Their timing is still true; what is gone is the detail. Reported rather than dropped, because a request with no operations reads as one that ran nothing (invariant 14)."
        },
        "truncated": {
          "type": "integer",
          "minimum": 0,
          "description": "Requests that ran more operations than the register keeps per request. Their count is real and their list is not complete."
        },
        "shed": {
          "$ref": "#/$defs/Shed"
        },
        "dependenciesTruncated": {
          "type": "integer",
          "minimum": 0,
          "description": "Requests whose list of dependencies was truncated. Their count is real and their list is not complete. A sender that knows the field sends it, zero included. Absent in an evidence of protocol 0.9.0 or later is zero: @downtrace/agent 0.9.0 omitted it at zero. Absent in an earlier protocol is a sender older than the field, which did not say, and that is not none."
        }
      }
    },
    "Shed": {
      "type": "object",
      "title": "Shed",
      "additionalProperties": false,
      "required": ["ms", "reason"],
      "description": "The time inside [startedAt, endedAt] when the instrumentation was not writing the fine detail — neither the register's ring nor the reserve — because it was shedding it. Present when some part of the window was shed, absent when there was no shedding, when the shedding came from configuration (`DOWNTRACE_SHED`, the benchmark) and so the instrumentation never decided it, or when the instrumentation predates the field: a sender older than the field sends nothing, and the cloud stores the absence as such (ADR 0008). The capture is still taken, not refused: the window can end before the shedding does, the coarse register keeps measuring, and the protocol has no way for an instance to refuse an order — saying it in the evidence is what CAP-01 asks for.",
      "properties": {
        "ms": {
          "type": "integer",
          "minimum": 1,
          "description": "How long the shedding lasted, in whole milliseconds, rounded up: one millisecond of shedding is still shedding, and the field says so rather than rounding it into silence."
        },
        "reason": {
          "type": "string",
          "enum": ["latency", "memory"],
          "description": "The last reason in force inside the window, the same enum as `agent.resources.shedReason` in the batch: why it gave ground. One value and not a list: a window that shed for two reasons is read as the one in force when it ended, which is the one still changing what arrives."
        }
      }
    },
    "CapturedRequest": {
      "type": "object",
      "title": "CapturedRequest",
      "additionalProperties": false,
      "required": ["method", "route", "status", "startedAt", "durationMs", "operations"],
      "properties": {
        "method": {
          "type": "string",
          "maxLength": 16
        },
        "route": {
          "type": "string",
          "maxLength": 512,
          "description": "The route template, never the path with its values in it (invariant 5)."
        },
        "status": {
          "type": "integer",
          "minimum": 100,
          "maximum": 599
        },
        "startedAt": {
          "type": "string",
          "format": "date-time",
          "description": "When this request started. Absolute, so requests from two instances can be read side by side."
        },
        "durationMs": {
          "type": "number",
          "minimum": 0
        },
        "poolWaitMs": {
          "type": "number",
          "minimum": 0,
          "description": "How long this request waited for a connection from a pool before it could talk to the dependency at all. **Absent means this request asked no pool**, which is not a wait of zero: zero is a request that asked and was served at once. The pool-saturation trigger compares wait per request, so a route that never queues must not read as one that queues for nothing (invariant 14)."
        },
        "operations": {
          "type": "array",
          "maxItems": 256,
          "items": {
            "$ref": "#/$defs/CapturedOperation"
          },
          "description": "What it ran, in the order it started them. Empty means it ran nothing — unless `detailLost` says the list was overwritten, which is why that flag is on the request and not only in the totals."
        },
        "truncated": {
          "type": "boolean",
          "description": "This request ran more operations than the register keeps per request. Absent means false."
        },
        "detailLost": {
          "type": "boolean",
          "description": "This request's operations were overwritten before they were read. Absent means false. Its timing is still true."
        },
        "dependenciesTruncated": {
          "type": "boolean",
          "description": "This request's list of dependencies did not fit and was truncated to what the register keeps per request. A dependency not in the list is not proven not to have been used (invariant 14). Absent means false."
        }
      }
    },
    "CapturedOperation": {
      "type": "object",
      "title": "CapturedOperation",
      "additionalProperties": false,
      "required": ["hash", "startMs", "endMs"],
      "description": "One operation inside a request. Starts and ends and not durations, because the whole reason for capturing detail is order and overlap, which a duration cannot express (ADR 0068).",
      "properties": {
        "kind": {
          "enum": ["query", "error", "framework", "explicit", "call", "command"],
          "description": "What kind of operation this is, in the words of the batch's `Operation.kind`, whose enum this borrows: a query, an outgoing call or a Redis command the request ran, or one of the kinds of error recorded in it beside what failed. Since 0.9.0. **Absent means the sender did not say**, never a query: an instrumentation older than the field wrote every operation it recorded here without one, the error signatures beside a failed query among them, and a reader that took them for queries would be naming what it was not told."
        },
        "hash": {
          "type": "string",
          "minLength": 1,
          "maxLength": 64,
          "description": "The fingerprint's hash. Never the text: the profile is where a sender chooses whether to ship the text of its queries, and this path never carries it (invariant 5, ADR 0017)."
        },
        "startMs": {
          "type": "number",
          "minimum": 0,
          "description": "Milliseconds from the start of its own request."
        },
        "endMs": {
          "type": "number",
          "minimum": 0
        }
      }
    },
    "Reference": {
      "type": "object",
      "title": "ReferenceSamples",
      "additionalProperties": false,
      "required": ["selection", "population", "samples"],
      "description": "A few requests of each endpoint kept as something to compare the captured ones against. `product.md:100`: «Comparing degraded requests against reference requests requires keeping both; the fine detail of an hour ago no longer exists». Being earlier does not certify health, which is why every field here is about how they were chosen and none of them says «healthy».",
      "properties": {
        "selection": {
          "type": "string",
          "enum": ["uniform-reservoir"],
          "description": "How they were chosen. Travels with them because a sample whose selection is unknown cannot support an attribution (ATR-01). `uniform-reservoir`: every request observed of that endpoint had the same chance of being kept, whatever it did — which is what «the fastest N» would not be."
        },
        "population": {
          "type": "integer",
          "minimum": 0,
          "description": "How many requests they were drawn from, over the life of the sending process."
        },
        "routesDropped": {
          "type": "integer",
          "minimum": 0,
          "description": "Routes the register had no row for, folded into one shared row, counted once each. At the register's cap for how many it may remember it is a lower bound: a bounded memory does not count distinct names past its bound, and the volume of what was folded is what the shared row keeps."
        },
        "renewalPaused": {
          "type": "boolean",
          "description": "True when requests were observed that the register deliberately did not consider. The instrumentation pauses renewal while it is watching a capture, which is the closest it can get to REF-01 from inside the process: it cannot know whether an incident is open, but it knows detail has been asked of it. Absent means false."
        },
        "samples": {
          "type": "array",
          "maxItems": 64,
          "items": {
            "$ref": "#/$defs/CapturedRequest"
          },
          "description": "The kept requests, in the same shape as the captured ones. An empty array is a real answer: a process that has just started has nothing to compare with yet."
        }
      }
    },
    "CoarseSummary": {
      "type": "object",
      "title": "CoarseSummary",
      "additionalProperties": false,
      "required": ["windowSeconds", "routes", "eventLoop", "routesDropped"],
      "description": "The coarse half of the black box, frozen: the last few minutes, second by second, so a reader can see how something detected late began (`product.md:94`). Sums and a maximum, never percentiles: the interval aggregate answers the percentile question with exactness, and this answers the shape of the change (`product.md:122`). What an older instrumentation did not send is absent from the evidence, and stored as absent.",
      "properties": {
        "windowSeconds": {
          "type": "integer",
          "minimum": 1,
          "description": "How many seconds the summary covers: the length of the register's window, and the most any of the lists below may hold."
        },
        "routesDropped": {
          "type": "integer",
          "minimum": 0,
          "description": "Routes the register had no row for, folded into one shared row, counted once each. At the register's cap for how many it may remember it is a lower bound: a bounded memory does not count distinct names past its bound, and the volume of what was folded is what the shared row keeps."
        },
        "routes": {
          "type": "array",
          "maxItems": 129,
          "items": {
            "$ref": "#/$defs/CoarseRoute"
          },
          "description": "One entry per route with a row of its own, the last being the shared row for what did not fit, when there is one. A route's series starts at the first second this process saw the route: before it, nobody was watching this route, and inventing silence there would say the route was quiet when the truth is that it was unwatched (invariant 14)."
        },
        "eventLoop": {
          "type": "array",
          "maxItems": 300,
          "items": {
            "$ref": "#/$defs/CoarseEventLoopSecond"
          },
          "description": "The process's event loop delay, second by second, in its own series and not attributed to any route: it is the process's, and attributing it to a route would be inventing a measurement. Only the seconds somebody sampled are here: a second with no reading says nothing about the loop, and a zero would say it was idle. An empty array is a real answer: the process had no event loop to sample, or nobody did."
        }
      }
    },
    "CoarseRoute": {
      "type": "object",
      "title": "CoarseRoute",
      "additionalProperties": false,
      "required": ["method", "route", "seconds"],
      "properties": {
        "method": {
          "type": "string",
          "maxLength": 16
        },
        "route": {
          "type": "string",
          "maxLength": 512,
          "description": "The route template, never the path with its values in it (invariant 5)."
        },
        "seconds": {
          "type": "array",
          "maxItems": 300,
          "items": {
            "$ref": "#/$defs/CoarseSecond"
          }
        }
      }
    },
    "CoarseSecond": {
      "type": "object",
      "title": "CoarseSecond",
      "additionalProperties": false,
      "required": ["second", "requests", "errors", "latencySumMs", "latencyMaxMs", "calls"],
      "description": "One second of one route. Sums and a maximum, never a histogram: a histogram per second per route would multiply the memory by its buckets to answer a question the interval already answers.",
      "properties": {
        "second": {
          "type": "integer",
          "description": "The Unix second this row covers, an integer instant like the ones a batch writes: a reader aligns it with the dates the evidence writes by flooring them."
        },
        "requests": {
          "type": "integer",
          "minimum": 0,
          "description": "Requests this route answered in this second. Zero is a real answer: a watched second with no traffic, and not an absence."
        },
        "errors": {
          "type": "integer",
          "minimum": 0,
          "description": "Requests that answered 5xx."
        },
        "latencySumMs": {
          "type": "number",
          "minimum": 0
        },
        "latencyMaxMs": {
          "type": "number",
          "minimum": 0
        },
        "calls": {
          "type": "integer",
          "minimum": 0,
          "description": "Operations the requests of this second ran."
        }
      }
    },
    "CoarseEventLoopSecond": {
      "type": "object",
      "title": "CoarseEventLoopSecond",
      "additionalProperties": false,
      "required": ["second", "maxDelayMs"],
      "properties": {
        "second": {
          "type": "integer",
          "description": "The Unix second this reading covers."
        },
        "maxDelayMs": {
          "type": "number",
          "minimum": 0,
          "description": "The worst delay sampled in this second: a second that stalled once stalled, and averaging it away is how a stall becomes invisible."
        }
      }
    }
  }
}
