{
  "protocol": "0.9.0",
  "instance": { "id": "7d1e9c6a-4f2b-4c1e-9b0a-2f6d3e8a1c55", "hostname": "web-1", "pid": 4242 },
  "startedAt": "2026-09-10T10:00:00.000Z",
  "endedAt": "2026-09-10T10:01:00.000Z",
  "coverage": {
    "observedRequests": 1,
    "attachedRequests": 1,
    "detailLost": 0,
    "truncated": 0,
    "dependenciesTruncated": 1
  },
  "requests": [
    {
      "method": "GET",
      "route": "/cart",
      "status": 200,
      "startedAt": "2026-09-10T09:59:12.120Z",
      "durationMs": 412.5,
      "operations": [{ "hash": "9f2b1c", "startMs": 1.2, "endMs": 38.4 }],
      "dependenciesTruncated": true
    },
    {
      "method": "GET",
      "route": "/cart",
      "status": 500,
      "startedAt": "2026-09-10T09:59:58.900Z",
      "durationMs": 88,
      "operations": []
    }
  ]
}
