{
  "protocol": "0.9.0",
  "instance": {
    "id": "7d1e9c6a-4f2b-4c1e-9b0a-2f6d3e8a1c55",
    "hostname": "web-1",
    "pid": 4242
  },
  "startedAt": "2026-09-10T10:00:00.000Z",
  "endedAt": "2026-09-10T10:01:00.000Z",
  "coverage": {
    "observedRequests": 1,
    "attachedRequests": 0,
    "detailLost": 0,
    "truncated": 0
  },
  "requests": [
    {
      "method": "POST",
      "route": "/checkout",
      "status": 200,
      "startedAt": "2026-09-10T10:00:03.120Z",
      "durationMs": 250,
      "operations": [
        {
          "kind": "query",
          "hash": "9f2b1c",
          "startMs": 1.2,
          "endMs": 38.4
        },
        {
          "kind": "call",
          "hash": "3e1f0a9c5b7d2468",
          "startMs": 40,
          "endMs": 240
        },
        {
          "kind": "call",
          "hash": "3e1f0a9c5b7d2468",
          "startMs": 40,
          "endMs": 240
        },
        {
          "kind": "command",
          "hash": "5d2c8e4f1a6b9073",
          "startMs": 241,
          "endMs": 242.5
        },
        {
          "kind": "error",
          "hash": "c4d5e6f708192a3b",
          "startMs": 241,
          "endMs": 242.5
        }
      ]
    }
  ]
}
